{
  "$schema": "https://json-schema.org/draft/2020-12/schema",
  "$id": "https://live-comc-app/schemas/broadcast_context.schema.json",
  "title": "broadcast_context",
  "description": "파이프라인 ⑤ 컨텍스트 조립 단계의 출력. LLM(⑥)에 넘길 발화 허용 범위 + 근거 풀. 금칙 섹션은 이 단계 이전에 이미 제거된 상태여야 한다.",
  "type": "object",
  "properties": {
    "current_part_id": {
      "type": "string",
      "description": "현재 진행 중인 파트 id (rundown_index.parts[].id 참조)"
    },
    "coverage_state": {
      "type": "string",
      "enum": [
        "defined",
        "directive",
        "undefined"
      ],
      "description": "현재 파트의 커버리지 상태. undefined면 컨텍스트를 조립하지 않고 HITL로 되묻는다"
    },
    "coverage_items": {
      "type": "array",
      "items": {
        "type": "string"
      },
      "description": "발화 허용 화이트리스트. LLM은 이 범위 밖 주제를 생성하면 안 된다"
    },
    "evidence_pool": {
      "type": "array",
      "description": "claim_map의 evidence_quote가 반드시 이 안에서 나와야 하는 근거 문자열 풀",
      "items": {
        "type": "object",
        "properties": {
          "path": {
            "type": "string",
            "description": "근거 문서 볼트 경로"
          },
          "quote": {
            "type": "string",
            "description": "인용 가능한 원문 문자열"
          }
        },
        "required": [
          "path",
          "quote"
        ],
        "additionalProperties": false
      }
    },
    "status_map": {
      "type": "object",
      "description": "참조 문서별 최신성/상태 플래그 (예: {'rundown':'final','dashboard':'stale'})",
      "additionalProperties": {
        "type": "string"
      }
    },
    "forbidden_removed": {
      "type": "boolean",
      "description": "excluded_sections가 이 컨텍스트에서 실제로 제거되었음을 단언하는 불변식 플래그 (true 강제)",
      "const": true
    },
    "excluded_headings": {
      "type": "array",
      "description": "이번 방송에서 제외된 섹션의 **이름만**. 본문은 담지 않는다. M8 발견: 진행자가 금칙 섹션을 이름으로 물으면 그 이름이 발화문을 타고 프롬프트에 들어간다. 거절하려면 무엇이 금칙인지 알아야 하므로 이름을 여기까지 가져온다. build_prompt 는 이 필드를 쓰지 않는다.",
      "items": {
        "type": "string"
      }
    },
    "withheld_conditional": {
      "type": "array",
      "description": "조건 미충족으로 근거 풀에서 보류한 조건부 섹션. safety_policy 의 conditional.time_gated 집행 기록이다. 무엇을 왜 뺐는지 남지 않으면 '원래 없었다'와 구분되지 않는다.",
      "items": {
        "type": "object",
        "properties": {
          "heading": {
            "type": "string"
          },
          "condition": {
            "type": "string"
          },
          "reason": {
            "type": "string"
          }
        },
        "required": [
          "heading",
          "condition",
          "reason"
        ],
        "additionalProperties": false
      }
    },
    "assembled_at": {
      "type": "string",
      "format": "date-time"
    },
    "other_parts": {
      "type": "array",
      "description": "현재 파트가 아닌 파트의 이름만 (본문 없음). 다른 파트를 묻는 질문을 이 파트 근거로 답하지 않기 위한 재료 — 사고 10 (2026-09-13)",
      "items": {
        "type": "object",
        "properties": {
          "id": {
            "type": "string"
          },
          "title": {
            "type": "string"
          },
          "coverage_state": {
            "type": "string",
            "enum": [
              "defined",
              "directive",
              "undefined"
            ],
            "description": "rundown_index.parts[].coverage_state 와 같은 3분류"
          }
        },
        "required": [
          "id",
          "title",
          "coverage_state"
        ],
        "additionalProperties": false
      }
    }
  },
  "required": [
    "current_part_id",
    "coverage_state",
    "coverage_items",
    "evidence_pool",
    "forbidden_removed"
  ],
  "additionalProperties": false
}