{
  "current_part_id": "3",
  "coverage_state": "directive",
  "coverage_items": [
    "Claude Artifacts & Routines",
    "Seattle AI Week 준비"
  ],
  "evidence_pool": [
    {
      "path": "AI/Roundup/2026-09-20 - Live29 Weekly Rundown.md#시간 여유 시 학습#이번 방송 커버리지",
      "quote": "[확정] 이번 방송 커버리지 — Claude Artifacts & Routines"
    },
    {
      "path": "AI/Roundup/2026-09-20 - Live29 Weekly Rundown.md#시간 여유 시 학습#이번 방송 커버리지",
      "quote": "[확정] 이번 방송 커버리지 — Seattle AI Week 준비"
    },
    {
      "path": "AI/Roundup/2026-09-20 - Live29 Weekly Rundown.md#시간 여유 시 학습",
      "quote": "[확정 항목 현재 상태] Claude Artifacts & Routines — 대기 — M4a 까지 진행(9/21), M3 미착수"
    },
    {
      "path": "AI/Roundup/2026-09-20 - Live29 Weekly Rundown.md#시간 여유 시 학습",
      "quote": "[확정 항목 현재 상태] Seattle AI Week 준비 — 대기 — 티켓 일정 확정 기한이 9/27, 시간이 남으면 방송에서 · 아니면 방송 뒤"
    },
    {
      "path": "AI/Roundup/2026-09-20 - Live29 Weekly Rundown.md#시간 여유 시 학습",
      "quote": "Claude Artifacts: 9/25 Builders Lounge 홍보 페이지를 기존 Artifact 에 업데이트하면서, 공유 링크가 특정 버전에 고정된다는 것과 공유 버전을 Latest 로 두면 새로 올린 내용이 바로 보인다는 것을 확인했습니다."
    },
    {
      "path": "AI/Roundup/2026-09-20 - Live29 Weekly Rundown.md#시간 여유 시 학습",
      "quote": "Seattle AI Week: 시간이 남으면 방송에서 티켓 일정 확정 작업(예산과 참석 가능한 날짜)을 하고, 시간이 없으면 방송이 끝난 뒤 따로 합니다."
    }
  ],
  "status_map": {
    "rundown": "final",
    "2026-09-20 - Weekly Progress and Planning": "missing_section",
    "2026-09-20 - Weekly Dashboard.canvas": "skipped:canvas",
    "2026-09-13 - Live28 Weekly Rundown": "missing_section",
    "2026-09-13~2026-09-20 - Claude Code": "missing_section",
    "Task Board": "missing_section"
  },
  "excluded_headings": [
    "주간 영상 (이번 방송 미편성)",
    "유튜브 업로드 자료 (이번 방송 미편성)"
  ],
  "withheld_conditional": [],
  "forbidden_removed": true,
  "other_parts": [
    {
      "id": "0",
      "title": "인트로",
      "coverage_state": "defined"
    },
    {
      "id": "1",
      "title": "지난주 생성 콘텐츠",
      "coverage_state": "defined"
    },
    {
      "id": "2",
      "title": "오늘의 실험",
      "coverage_state": "defined"
    },
    {
      "id": "4",
      "title": "아웃트로",
      "coverage_state": "undefined"
    }
  ],
  "assembled_at": "2026-09-27T14:53:02.621541+00:00"
}
